"url","id","definition_en","definition_it","label_it","label_en","parent"
"https://w3id.org/italia/real-estate/controlled-vocabulary/StateProperty/CodiceMEFRaccordoSECImmobile/BA","BA","Non-financial assets that have come into existence as outputs from production processes. Produced assets consist of fixed assets, inventories and valuables, as defined below.","Attività non finanziarie ottenute quale prodotto dei processi di produzione. Le attività prodotte sono costituite da capitale fisso, scorte e oggetti di valore, come specificato in appresso.","ATTIVITÀ NON FINANZIARIE PRODOTTE","NON-FINANCIAL PRODUCTED ASSETS",""
"https://w3id.org/italia/real-estate/controlled-vocabulary/StateProperty/CodiceMEFRaccordoSECImmobile/BAAA","BA AA","Produced assets that are used repeatedly or continuously in production processes for more than one year. Fixed assets consist of tangible and intangible fixed assets, as defined below.","Attività prodotte utilizzate ripetutamente o continuamente nei processi di produzione per più di un anno. Il capitale fisso è composto da beni materiali e beni immateriali come specificato in appresso.","Capitale fisso","Fixed assets","https://w3id.org/italia/real-estate/controlled-vocabulary/StateProperty/CodiceMEFRaccordoSECImmobile/BA"
"https://w3id.org/italia/real-estate/controlled-vocabulary/StateProperty/CodiceMEFRaccordoSECImmobile/BAAAAA","BA AA AA","Fixed assets that consist of dwellings; other buildings, permanent structures intended for national defense, immovable property of cultural value, other structures different from dwellings and buildings, rights in rem of enjoyment over property owned by others, plants, equipment and machinery, furniture and furnishings, means of transport, weapons and military armaments, bibliographic material, equipment and clothing, musical instruments, crops and livestock, as well as other produced tangible assets as specified below.","Capitale fisso costituito da abitazioni, fabbricati non residenziali, opere permanenti destinate alla difesa nazionale, beni immobili di valore culturale, altre opere diverse delle abitazioni e dai fabbricati, diritti reali di godimento su beni altrui, impianti attrezzature e macchinari, mobili e arredi, mezzi di trasporto, armi ed armamenti militari, materiale bibliografico, equipaggiamenti e vestiari, strumenti musicali, coltivazioni ed allevamenti nonché altri beni materiali prodotti come di seguito specificati.","BENI MATERIALI PRODOTTI","TANGIBLE FIXED ASSETS","https://w3id.org/italia/real-estate/controlled-vocabulary/StateProperty/CodiceMEFRaccordoSECImmobile/BAAA"
"https://w3id.org/italia/real-estate/controlled-vocabulary/StateProperty/CodiceMEFRaccordoSECImmobile/BAAAAAAA","BA AA AA AA","Buildings that are used entirely or primarily as residences, including any associated structures, such as garages, and all permanent fixtures customarily installed in residences. Houseboats, barges, mobile homes and caravans used as principal residences of households are also included, as are historic monuments identified primarily as dwellings. Costs of site clearance and preparation are also included.
Examples include residential buildings, such as one- and two-dwelling buildings and other residential buildings intended for non-transient occupancy.
Uncompleted dwellings are included to the extent that the ultimate user is deemed to have taken ownership, either because the construction is on own account or as evidenced by the existence of a contract of sale/purchase.","Fabbricati utilizzati interamente o principalmente come abitazioni, comprese le costruzioni annesse, come i garage, e tutti gli impianti permanenti usualmente installati nelle abitazioni. Sono incluse altresì le case galleggianti, le chiatte, le case viaggianti e i caravan utilizzati quali residenze principali delle famiglie, come pure i monumenti storici se destinati principalmente ad abitazioni. Sono inclusi anche i costi dèi lavori di sgombero del cantiere e di preparazione del terreno.
Esempi: edifici residenziali come i fabbricati a uno o due alloggi e gli altri edifici residenziali destinati ad essere occupati stabilmente.
Le abitazioni non completate sono incluse nella misura in cui si considera che l'utilizzatore finale ne è divenuto proprietario o perché sono state costruite per uso proprio o perché è stato stipulato un contratto di compravendita.","Abitazioni","Dwellings","https://w3id.org/italia/real-estate/controlled-vocabulary/StateProperty/CodiceMEFRaccordoSECImmobile/BAAAAA"
"https://w3id.org/italia/real-estate/controlled-vocabulary/StateProperty/CodiceMEFRaccordoSECImmobile/BAAAAAAAAA","BA AA AA AA AA","Residential buildings located in urban or civil contexts, intended for family occupancy, including any service housing and ancillary structures such as garages and permanent installations.","Edifici residenziali situati in contesti urbani o civili, destinati a nuclei familiari, comprensivi di eventuali alloggi di servizio e strutture accessorie come garage e impianti permanenti.","FABBRICATI CIVILI USO ABITATIVO (INCLUSI GLI ALLOGGI DI SERVIZIO)","RESIDENTIAL BUILDINGS (INCLUDING SERVICE HOUSING)","https://w3id.org/italia/real-estate/controlled-vocabulary/StateProperty/CodiceMEFRaccordoSECImmobile/BAAAAAAA"
"https://w3id.org/italia/real-estate/controlled-vocabulary/StateProperty/CodiceMEFRaccordoSECImmobile/BAAAAAAABA","BA AA AA AA BA","Dwellings situated in rural or agricultural areas, including annexed constructions necessary for daily life, intended for stable family occupancy.","Abitazioni situate in aree rurali o agricole, comprese le costruzioni annesse necessarie per la vita quotidiana, destinate a essere occupate stabilmente dalle famiglie.","FABBRICATI RURALI USO ABITATIVO","RURAL RESIDENTIAL BUILDINGS","https://w3id.org/italia/real-estate/controlled-vocabulary/StateProperty/CodiceMEFRaccordoSECImmobile/BAAAAAAA"
"https://w3id.org/italia/real-estate/controlled-vocabulary/StateProperty/CodiceMEFRaccordoSECImmobile/BAAAAAAAEA","BA AA AA AA EA","Public or social housing managed by the Autonomous Institute for Public Housing (I.A.C.P.), intended for stable residential use by families with specific social or economic requirements.","Abitazioni pubbliche o sociali gestite dall’Istituto Autonomo Case Popolari, destinate a uso residenziale stabile di famiglie con particolari requisiti sociali o economici.","FABBRICATI GESTITI DALLO I.A.C.P.","BUILDINGS MANAGED BY I.A.C.P.","https://w3id.org/italia/real-estate/controlled-vocabulary/StateProperty/CodiceMEFRaccordoSECImmobile/BAAAAAAA"
"https://w3id.org/italia/real-estate/controlled-vocabulary/StateProperty/CodiceMEFRaccordoSECImmobile/BAAAAAAAFA","BA AA AA AA FA","Public or social housing owned by local authorities (municipalities, provinces, or other territorial entities), including ancillary structures and permanent installations, intended for residential use by the community or specific family units.","Abitazioni di proprietà pubblica o sociale gestite da comuni, province o altre autorità locali, comprese le strutture accessorie e gli impianti permanenti, destinate all’uso residenziale della comunità o di specifici nuclei familiari.","FABBRICATI GESTITI DAGLI ENTI TERRITORIALI","BUILDINGS MANAGED BY LOCAL AUTHORITIES","https://w3id.org/italia/real-estate/controlled-vocabulary/StateProperty/CodiceMEFRaccordoSECImmobile/BAAAAAAA"
"https://w3id.org/italia/real-estate/controlled-vocabulary/StateProperty/CodiceMEFRaccordoSECImmobile/BAAAAABA","BA AA AA BA","Buildings other than dwellings, including fixtures, facilities and equipment that are integral parts of the structures and costs of site clearance and preparation. Included are structures intended for worship—churches, charterhouses, abbeys—excluding worship-related land holdings. Also included are arsenals and facilities belonging to both the operational area and the technical-industrial area of the Defence sector. Prefabricated structures located in military areas and used as temporary housing and/or offices, workshops, and material depots. Barracks, until they are transferred to the State Property Agencies. Other buildings not yet completed are included to the extent that the final user is considered to have become the owner, either because a procurement contract has been signed or because a purchase agreement has been concluded.","Fabbricati diversi dalle abitazioni, compresi gli impianti e le attrezzature che costituiscono parte integrante delle costruzioni e compresi i costi dei lavori di sgombero dei cantieri e di preparazione del terreno. Sono incluse opere destinate al culto, chiese, certose, abbazie escluse fondo culto. Inoltre arsenali e stabilimenti sia dell'area operativa che dell'area tecnico-industriale della Difesa. Prefabbricati situati in aree militari con destinazione di alloggi temporanei e/o di uffici, officine depositi di materiali. Caserme sino a quando non sono transitate in carico alle Agenzie del Demanio. Gli altri fabbricati non ancora completati sono inclusi nella misura in cui si considera che l'utilizzatore finale ne è divenuto proprietario o perché è stato stipulato un contratto di appalto o perché è stato stipulato un contratto di compravendita.","Fabbricati non residenziali","Non-residential buildings","https://w3id.org/italia/real-estate/controlled-vocabulary/StateProperty/CodiceMEFRaccordoSECImmobile/BAAAAA"
"https://w3id.org/italia/real-estate/controlled-vocabulary/StateProperty/CodiceMEFRaccordoSECImmobile/BAAAAABAAA","BA AA AA BA AA","Buildings used as public offices, state administrations, and barracks until transferred to the management of the State Property Agencies, including permanent installations and equipment.","Edifici destinati a uffici pubblici, amministrazioni statali, e caserme fino al momento del trasferimento alla gestione delle Agenzie del Demanio, comprensivi di impianti e strutture permanenti.","FABBRICATI CIVILI ADIBITI A FINI ISTITUZIONALI (USO GOVERNATIVO E CASERME)","CIVIL BUILDINGS FOR INSTITUTIONAL PURPOSES (GOVERNMENT USE AND BARRACKS)","https://w3id.org/italia/real-estate/controlled-vocabulary/StateProperty/CodiceMEFRaccordoSECImmobile/BAAAAABA"
"https://w3id.org/italia/real-estate/controlled-vocabulary/StateProperty/CodiceMEFRaccordoSECImmobile/BAAAAABABA","BA AA AA BA BA","Buildings used for commercial activities, such as shops, service centers, and private offices, including permanent equipment necessary for operation.","Edifici adibiti ad attività commerciali, come negozi, centri servizi e uffici privati, comprensivi delle attrezzature permanenti necessarie per il funzionamento.","FABBRICATI COMMERCIALI","COMMERCIAL BUILDINGS","https://w3id.org/italia/real-estate/controlled-vocabulary/StateProperty/CodiceMEFRaccordoSECImmobile/BAAAAABA"
"https://w3id.org/italia/real-estate/controlled-vocabulary/StateProperty/CodiceMEFRaccordoSECImmobile/BAAAAABACA","BA AA AA BA CA","Structures in agricultural or rural areas used for productive activities other than housing, such as stables, agricultural warehouses, and material storage facilities.","Costruzioni in aree agricole o rurali utilizzate per attività produttive diverse dall’abitazione, come stalle, magazzini agricoli e depositi di materiali.","FABBRICATI RURALI","RURAL BUILDINGS","https://w3id.org/italia/real-estate/controlled-vocabulary/StateProperty/CodiceMEFRaccordoSECImmobile/BAAAAABA"
"https://w3id.org/italia/real-estate/controlled-vocabulary/StateProperty/CodiceMEFRaccordoSECImmobile/BAAAAABADA","BA AA AA BA DA","Industrial plants, workshops, material depots, and prefabricated structures, including those located in military areas intended for offices or temporary housing.","Stabilimenti industriali, officine, depositi di materiali e prefabbricati, inclusi quelli situati in aree militari destinati a uffici o alloggi temporanei.","FABBRICATI INDUSTRIALI E COSTRUZIONI LEGGERE","INDUSTRIAL BUILDINGS AND LIGHT CONSTRUCTIONS","https://w3id.org/italia/real-estate/controlled-vocabulary/StateProperty/CodiceMEFRaccordoSECImmobile/BAAAAABA"
"https://w3id.org/italia/real-estate/controlled-vocabulary/StateProperty/CodiceMEFRaccordoSECImmobile/BAAAAABAEA","BA AA AA BA EA","Religious buildings such as churches, charterhouses, and abbeys (excluding worship-related land), including annexed structures and permanent installations.","Edifici religiosi come chiese, certose e abbazie (escluso il fondo culto), comprese le strutture annesse e gli impianti permanenti.","OPERE DESTINATE AL CULTO","RELIGIOUS BUILDINGS","https://w3id.org/italia/real-estate/controlled-vocabulary/StateProperty/CodiceMEFRaccordoSECImmobile/BAAAAABA"
"https://w3id.org/italia/real-estate/controlled-vocabulary/StateProperty/CodiceMEFRaccordoSECImmobile/BAAAAABAHA","BA AA AA BA HA","Other incomplete buildings or buildings with specific purposes not included in the previous categories, including those under construction or acquired through procurement or purchase agreements.","Altri fabbricati non completati o con destinazioni particolari non ricomprese nelle categorie precedenti, inclusi quelli in costruzione o acquisiti tramite appalto o contratto di compravendita.","ALTRO","OTHER","https://w3id.org/italia/real-estate/controlled-vocabulary/StateProperty/CodiceMEFRaccordoSECImmobile/BAAAAABA"
"https://w3id.org/italia/real-estate/controlled-vocabulary/StateProperty/CodiceMEFRaccordoSECImmobile/BAAAAACA","BA AA AA CA","Buildings of artistic, historical, archaeological or paleontological interest, or which, due to their association with political or military history, literature, art, or culture in general, have been recognized as being of particularly significant interest, as well as restoration works (to be capitalized) aimed at maintaining their material integrity and ensuring the preservation and protection of their cultural value.","Fabbricati che presentano interesse artistico, storico, archeologico, paleontologico o che, a causa del loro riferimento con la storia politica, militare, della letteratura, dell'arte e della cultura in genere, siano stati riconosciuti di interesse particolarmente importante, nonché le opere di restauro (da capitalizzarsi) volte a mantenerne l'integrità materiale e ad assicurare la conservazione e la protezione dei loro valori culturali.","Beni immobili di valore culturale","Cultural real estate assets","https://w3id.org/italia/real-estate/controlled-vocabulary/StateProperty/CodiceMEFRaccordoSECImmobile/BAAAAA"
"https://w3id.org/italia/real-estate/controlled-vocabulary/StateProperty/CodiceMEFRaccordoSECImmobile/BAAAAACABA","BA AA AA CA BA","Buildings recognized as being of particular interest for their artistic, historical, literary, or cultural value, including restoration works aimed at maintaining their material integrity and ensuring the preservation and protection of their cultural significance.","Fabbricati riconosciuti di particolare interesse per il loro valore artistico, storico, letterario o culturale, comprendendo anche opere di restauro finalizzate a mantenere l’integrità materiale e la conservazione dei loro valori culturali.","BENI ARTISTICI","ARTISTIC ASSETS","https://w3id.org/italia/real-estate/controlled-vocabulary/StateProperty/CodiceMEFRaccordoSECImmobile/BAAAAACA"
"https://w3id.org/italia/real-estate/controlled-vocabulary/StateProperty/CodiceMEFRaccordoSECImmobile/BAAAAACACA","BA AA AA CA CA","Buildings or structures of archaeological or paleontological relevance, including sites documenting historical periods and past cultures, with restoration interventions intended to preserve and protect the assets.","Fabbricati o strutture con rilevanza archeologica o paleontologica, inclusi siti che documentano periodi storici e culture passate, comprendendo interventi di restauro per la conservazione e protezione dei beni.","BENI ARCHEOLOGICI","ARCHAEOLOGICAL ASSETS","https://w3id.org/italia/real-estate/controlled-vocabulary/StateProperty/CodiceMEFRaccordoSECImmobile/BAAAAACA"
"https://w3id.org/italia/real-estate/controlled-vocabulary/StateProperty/CodiceMEFRaccordoSECImmobile/BAAAAAEA","BA AA AA EA","Structures other than buildings, including the cost of the streets, sewers and site clearance and preparation other than for buildings.
These include in particular:
Transportation routes: roads, motorways, waterways, passes, bridges, cableways, etc.;
Hydraulic structures and infrastructures: assets intended for regulating watercourses and ensuring their proper flow (dams, embankments, river-training works, irrigation canals, aqueducts, sewer systems, etc.);
Railways and related operating equipment: infrastructures—managed directly or assigned to third parties under government concession—connecting various points by means of rail systems: railways, tracks, rolling stock, etc.;
Sports facilities: facilities used for sporting activities (football fields, stadiums, tennis courts, gymnasiums, public swimming pools, and other facilities owned by the State);
Also included, separately, are structures under construction, which are accounted for when the final user is considered to have become the owner, either because a procurement contract has been concluded, as well as extraordinary maintenance works and land improvement works (i.e., interventions aimed at giving the territory an appropriate structure, such as land reclamation, protected area fencing, reforestation, etc.).","Opere diverse dai fabbricati, compresi i costi di costruzione di strade, di posa di fognature e dei lavori di sgombero del cantiere e di preparazione del terreno diversi da quelli per fabbricati.
Si comprendono in particolare:
Vie di comunicazione: strade, autostrade, idrovie, valichi, ponti, funivie, ecc.;
Strutture e infrastrutture idrauliche: ovvero beni volti alla regolamentazione dei corsi d'acqua ed al suo corretto deflusso (dighe, argini, sistemazione corsi d'acqua, canali di irrigazione, acquedotti, fognature, ecc.);
Strade ferrate e relativi materiali di esercizio: infrastrutture, gestite direttamente o affidate a terzi in concessione governativa, di diversi punti mediante sistemi ferrovari: ferrovie, binari, materiale rotabile, ecc.;
Impianti sportivi: impianti adibiti ad attività sportive (campi di calcio, stadi, campi di tennis, palestre ginnastiche, piscine pubbliche ed altri impianti di cui lo Stato è proprietario);
A parte si comprendono infine le opere in corso di costruzione, che sono incluse qualora si considera che l'utilizzatore finale ne è diventato proprietario o perché è stato stipulato un contratto di appalto, le opere di manutenzione straordinaria e le opere per la sistemazione del suolo (ovvero interventi per dare un opportuno assetto al territorio, come bonifiche, recinzioni aree protette, rimboschimenti, ecc.).","Altre opere","Other structures","https://w3id.org/italia/real-estate/controlled-vocabulary/StateProperty/CodiceMEFRaccordoSECImmobile/BAAAAA"
"https://w3id.org/italia/real-estate/controlled-vocabulary/StateProperty/CodiceMEFRaccordoSECImmobile/BAAAAAEAEA","BA AA AA EA EA","Structures intended for sporting activities, including gyms, stadiums, playing fields, public swimming pools, and other state-owned facilities, including permanent installations necessary for their operation and ancillary works.","Strutture destinate ad attività sportive, comprese palestre, stadi, campi da gioco, piscine pubbliche e altri impianti di proprietà dello Stato, inclusi gli impianti permanenti necessari al loro funzionamento e le opere accessorie.","IMPIANTI SPORTIVI","SPORT FACILITIES","https://w3id.org/italia/real-estate/controlled-vocabulary/StateProperty/CodiceMEFRaccordoSECImmobile/BAAAAAEA"
"https://w3id.org/italia/real-estate/controlled-vocabulary/StateProperty/CodiceMEFRaccordoSECImmobile/BAAAAAFA","BA AA AA FA","Rights that grant the holder (the State) a limited control or authority over property owned by third parties.","Diritti che attribuiscono al titolare (Stato) una signoria limitata su beni di terzi.","Diritti reali di godimento sui beni altrui","Rights of enjoyment over property owned by others","https://w3id.org/italia/real-estate/controlled-vocabulary/StateProperty/CodiceMEFRaccordoSECImmobile/BAAAAA"
"https://w3id.org/italia/real-estate/controlled-vocabulary/StateProperty/CodiceMEFRaccordoSECImmobile/BAAAAAFAAA","BA AA AA FA AA","Rights that grant the holder (the State) a limited control or authority over property owned by third parties.","Diritti che attribuiscono al titolare (Stato) una signoria limitata su beni di terzi.","DIRITTI REALI DI GODIMENTO SU BENI ALTRUI","RIGHTS OF ENJOYMENT OVER PROPERTY OWNED BY OTHERS","https://w3id.org/italia/real-estate/controlled-vocabulary/StateProperty/CodiceMEFRaccordoSECImmobile/BAAAAAFA"
"https://w3id.org/italia/real-estate/controlled-vocabulary/StateProperty/CodiceMEFRaccordoSECImmobile/BAAABA","BA AA BA","Fixed assets that consist of: mineral exploration, computer software, entertainment, literary or artistic originals and other intangible fixed assets, as defined below, intended to be used for more than one year.","Capitale fisso costituito da: prospezioni minerarie, software, originali di opere artistiche, letterarie o di intrattenimento o altri beni immateriali prodotti, come specificato in appresso, che si intende utilizzare per più di un anno.","BENI IMMATERIALI PRODOTTI","INTANGIBLE FIXED ASSETS","https://w3id.org/italia/real-estate/controlled-vocabulary/StateProperty/CodiceMEFRaccordoSECImmobile/BAAA"
"https://w3id.org/italia/real-estate/controlled-vocabulary/StateProperty/CodiceMEFRaccordoSECImmobile/BAAABAAA","BA AA BA AA","Rights over assets aimed at deriving the maximum possible benefit.","Diritti sui beni per ricavare il maggior utile possibile.","Diritti di sfruttamento","Exploitation rights","https://w3id.org/italia/real-estate/controlled-vocabulary/StateProperty/CodiceMEFRaccordoSECImmobile/BAAABA"
"https://w3id.org/italia/real-estate/controlled-vocabulary/StateProperty/CodiceMEFRaccordoSECImmobile/BAAABAAAAA","BA AA BA AA AA","The value of expenditures on exploration for petroleum and natural gas and for non-petroleum deposits. These expenditures include prelicence costs, licence and acquisition costs, appraisal costs and the costs of actual test drilling and boring, as well as the costs of aerial and other surveys, transportation costs, etc., incurred to make it possible to carry out the tests.","Importo delle spese per la ricerca di petrolio, di gas naturale e di giacimenti non petroliferi. Tali spese comprendono i costi precedenti all'ottenimento delle autorizzazioni, i costi per il rilascio delle autorizzazioni e i costi di acquisizione, i costi di valutazione e i costi delle effettive trivellazioni esplorative e di perforazione, come pure i costi di rilievi aerei o altre indagini, i costi di trasporto, ecc., sostenuti per rendere possibile l'esecuzione delle prospezioni.","PROSPEZIONI MINERARIE","MINERAL EXPLORATION","https://w3id.org/italia/real-estate/controlled-vocabulary/StateProperty/CodiceMEFRaccordoSECImmobile/BAAABAAA"
"https://w3id.org/italia/real-estate/controlled-vocabulary/StateProperty/CodiceMEFRaccordoSECImmobile/CA","CA","Non-financial assets that come into existence other than through processes of production. Non-produced assets consist of tangible assets and intangible assets, as defined below. ","Attività non finanziarie che non sono ottenute quale prodotti di processi di produzione. Le attività non prodotte sono costituite da beni materiali e beni immateriali, come specificato in appresso.","ATTIVITÀ NON FINANZIARIE
NON PRODOTTE","NON-FINANCIAL NON-PRODUCED ASSETS",""
"https://w3id.org/italia/real-estate/controlled-vocabulary/StateProperty/CodiceMEFRaccordoSECImmobile/CAAA","CA AA","Non-produced assets that occur in nature and over which ownership may be enforced and transferred. Environmental assets over which ownership rights have not, or cannot, be enforced are excluded. Tangible non-produced assets consist of natural state-owned assets, land, subsoil assets, non-cultivated biological resources.","Attività non prodotte presenti in natura sulle quali possono essere esercitati diritti di proprietà, incluso il trasferimento di questi. Sono esclusi i beni legati all'ambiente sui quali non sono o non possono essere esercitati diritti di proprietà. I beni materiali non prodotti sono costituiti da beni del demanio naturale, terreni, giacimenti, risorse biologiche non coltivate.","Beni materiali non prodotti","Tangible non-produced assets","https://w3id.org/italia/real-estate/controlled-vocabulary/StateProperty/CodiceMEFRaccordoSECImmobile/CA"
"https://w3id.org/italia/real-estate/controlled-vocabulary/StateProperty/CodiceMEFRaccordoSECImmobile/CAAAAA","CA AA AA","State-owned assets consisting of maritime, water, and forest public property.","Beni di proprietà dello Stato costituiti dal demanio marittimo, dal demanio idrico e forestale.","BENI DEL DEMANIO NATURALE","NATURAL STATE-OWNED ASSETS","https://w3id.org/italia/real-estate/controlled-vocabulary/StateProperty/CodiceMEFRaccordoSECImmobile/CAAA"
"https://w3id.org/italia/real-estate/controlled-vocabulary/StateProperty/CodiceMEFRaccordoSECImmobile/CAAAAAAA","CA AA AA AA","State-owned assets consisting of maritime, water, and forest public property.","Beni di proprietà dello Stato costituiti dal demanio marittimo, dal demanio idrico e forestale.","Beni del demanio naturale","Natural State-Owned Assets","https://w3id.org/italia/real-estate/controlled-vocabulary/StateProperty/CodiceMEFRaccordoSECImmobile/CAAAAA"
